{
  "$schema": "https://json-schema.org/draft/2020-12/schema",
  "title": "CBoard Recipe v1",
  "type": "object",
  "required": [
    "title",
    "mealType",
    "ingredients",
    "steps"
  ],
  "additionalProperties": false,
  "properties": {
    "schemaVersion": {
      "const": 1
    },
    "title": {
      "type": "string",
      "minLength": 1,
      "maxLength": 200
    },
    "slug": {
      "type": "string",
      "pattern": "^[a-z0-9]+(?:-[a-z0-9]+)*$",
      "maxLength": 100,
      "not": {
        "enum": [
          "manage",
          "import"
        ]
      }
    },
    "mealType": {
      "type": "string",
      "minLength": 1,
      "maxLength": 100
    },
    "description": {
      "type": "string",
      "maxLength": 4000
    },
    "nutrition": {
      "$ref": "#/$defs/nutrition"
    },
    "prepTime": {
      "type": [
        "string",
        "null"
      ],
      "maxLength": 100
    },
    "cookTime": {
      "type": [
        "string",
        "null"
      ],
      "maxLength": 100
    },
    "servings": {
      "type": [
        "number",
        "null"
      ],
      "exclusiveMinimum": 0
    },
    "ingredients": {
      "type": "array",
      "items": {
        "$ref": "#/$defs/ingredient"
      },
      "minItems": 1,
      "maxItems": 100
    },
    "steps": {
      "type": "array",
      "items": {
        "type": "string",
        "minLength": 1,
        "maxLength": 4000
      },
      "minItems": 1,
      "maxItems": 100
    },
    "sauces": {
      "type": "array",
      "items": {
        "anyOf": [
          {
            "type": "string",
            "minLength": 1,
            "maxLength": 200
          },
          {
            "$ref": "#/$defs/ingredient"
          }
        ]
      },
      "minItems": 0,
      "maxItems": 100
    },
    "alternatives": {
      "type": "object",
      "maxProperties": 100,
      "propertyNames": {
        "pattern": "^[a-z0-9]+(?:-[a-z0-9]+)*$",
        "not": {
          "enum": [
            "constructor",
            "prototype",
            "__proto__"
          ]
        }
      },
      "additionalProperties": {
        "type": "object",
        "required": [
          "title",
          "options"
        ],
        "properties": {
          "title": {
            "type": "string",
            "minLength": 1,
            "maxLength": 200
          },
          "options": {
            "type": "array",
            "items": {
              "$ref": "#/$defs/ingredient"
            },
            "minItems": 1,
            "maxItems": 100
          }
        },
        "additionalProperties": false
      }
    },
    "tags": {
      "type": "array",
      "items": {
        "type": "string",
        "minLength": 1,
        "maxLength": 100
      },
      "minItems": 0,
      "maxItems": 100
    },
    "source": {
      "type": [
        "object",
        "null"
      ],
      "required": [
        "url"
      ],
      "additionalProperties": false,
      "properties": {
        "type": {
          "type": "string",
          "maxLength": 100
        },
        "label": {
          "type": "string",
          "maxLength": 200
        },
        "url": {
          "type": "string",
          "minLength": 1,
          "maxLength": 2000,
          "description": "Absolute HTTP(S) URL. Import also accepts a Markdown link and normalizes it to its URL."
        },
        "showOnRecipeCard": {
          "type": "boolean",
          "default": false
        }
      }
    },
    "healthReview": {
      "type": [
        "object",
        "null"
      ],
      "additionalProperties": false,
      "required": [
        "version",
        "basis",
        "summary",
        "positives",
        "watchOuts",
        "suggestions",
        "limitations"
      ],
      "properties": {
        "version": {
          "const": 1
        },
        "basis": {
          "type": "string",
          "maxLength": 100000
        },
        "summary": {
          "type": "string",
          "maxLength": 300
        },
        "positives": {
          "type": "array",
          "maxItems": 3,
          "items": {
            "type": "string",
            "maxLength": 300
          }
        },
        "watchOuts": {
          "type": "array",
          "maxItems": 3,
          "items": {
            "type": "string",
            "maxLength": 300
          }
        },
        "suggestions": {
          "type": "array",
          "maxItems": 3,
          "items": {
            "type": "string",
            "maxLength": 300
          }
        },
        "limitations": {
          "type": "array",
          "maxItems": 3,
          "items": {
            "type": "string",
            "maxLength": 300
          }
        }
      }
    },
    "fibreSource": {
      "type": "object",
      "additionalProperties": false,
      "required": [
        "type",
        "basis",
        "servings",
        "value",
        "ingredients"
      ],
      "properties": {
        "type": {
          "enum": [
            "groceries",
            "ai"
          ]
        },
        "basis": {
          "enum": [
            "recipe",
            "serving"
          ]
        },
        "servings": {
          "type": "number",
          "exclusiveMinimum": 0,
          "maximum": 100
        },
        "value": {
          "type": "number",
          "minimum": 0
        },
        "ingredients": {
          "type": "string"
        }
      }
    },
    "productNutrition": {
      "type": "object",
      "description": "App-managed product label choices; nutrition is recalculated per serving.",
      "required": [
        "basis",
        "items"
      ],
      "additionalProperties": false,
      "properties": {
        "basis": {
          "type": "string"
        },
        "items": {
          "type": "array",
          "maxItems": 200,
          "items": {
            "anyOf": [
              {
                "type": "null"
              },
              {
                "type": "object",
                "required": [
                  "quantity",
                  "unit",
                  "nutrition"
                ],
                "additionalProperties": false,
                "properties": {
                  "quantity": {
                    "type": "number",
                    "exclusiveMinimum": 0
                  },
                  "unit": {
                    "enum": [
                      "g",
                      "ml",
                      "pieces"
                    ]
                  },
                  "nutrition": {
                    "type": "object",
                    "required": [
                      "quantity",
                      "unit"
                    ],
                    "properties": {
                      "quantity": {
                        "type": "number",
                        "exclusiveMinimum": 0
                      },
                      "unit": {
                        "enum": [
                          "g",
                          "ml",
                          "pieces"
                        ]
                      },
                      "calories": {
                        "type": [
                          "number",
                          "null"
                        ],
                        "minimum": 0
                      },
                      "protein": {
                        "type": [
                          "number",
                          "null"
                        ],
                        "minimum": 0
                      },
                      "carbs": {
                        "type": [
                          "number",
                          "null"
                        ],
                        "minimum": 0
                      },
                      "fat": {
                        "type": [
                          "number",
                          "null"
                        ],
                        "minimum": 0
                      },
                      "fiber": {
                        "type": [
                          "number",
                          "null"
                        ],
                        "minimum": 0
                      },
                      "source": {
                        "type": "object"
                      }
                    }
                  }
                }
              }
            ]
          }
        }
      }
    },
    "nutritionFromIngredients": {
      "type": "boolean",
      "description": "App-managed: calculate recipe nutrition per serving from ingredient and sauce quantities."
    }
  },
  "$defs": {
    "nutrition": {
      "type": "object",
      "properties": {
        "calories": {
          "type": [
            "number",
            "null"
          ],
          "minimum": 0
        },
        "protein": {
          "type": [
            "number",
            "null"
          ],
          "minimum": 0
        },
        "carbs": {
          "type": [
            "number",
            "null"
          ],
          "minimum": 0
        },
        "fat": {
          "type": [
            "number",
            "null"
          ],
          "minimum": 0
        },
        "fiber": {
          "type": [
            "number",
            "null"
          ],
          "minimum": 0
        }
      },
      "additionalProperties": false
    },
    "ingredient": {
      "type": "object",
      "required": [
        "name"
      ],
      "properties": {
        "name": {
          "type": "string",
          "minLength": 1,
          "maxLength": 200
        },
        "amount": {
          "anyOf": [
            {
              "type": [
                "number",
                "null"
              ],
              "minimum": 0
            },
            {
              "type": "string",
              "minLength": 1,
              "maxLength": 80
            }
          ]
        },
        "unit": {
          "type": "string",
          "maxLength": 80
        },
        "note": {
          "type": "string",
          "maxLength": 4000
        },
        "group": {
          "type": "string",
          "maxLength": 200,
          "description": "Recipe section or stage, such as Chicken marinade, Sauce, or Finishing."
        },
        "preparation": {
          "type": "string",
          "maxLength": 400,
          "description": "Preparation descriptor such as finely chopped, diced, or grated."
        },
        "nutrition": {
          "$ref": "#/$defs/nutrition"
        },
        "alternativeGroup": {
          "type": "string",
          "pattern": "^[a-z0-9]+(?:-[a-z0-9]+)*$",
          "maxLength": 100
        },
        "nutritionLabel": {
          "type": "object",
          "required": [
            "quantity",
            "unit"
          ],
          "properties": {
            "quantity": {
              "type": "number",
              "exclusiveMinimum": 0
            },
            "unit": {
              "enum": [
                "g",
                "ml",
                "pieces"
              ]
            },
            "calories": {
              "type": [
                "number",
                "null"
              ],
              "minimum": 0
            },
            "protein": {
              "type": [
                "number",
                "null"
              ],
              "minimum": 0
            },
            "carbs": {
              "type": [
                "number",
                "null"
              ],
              "minimum": 0
            },
            "fat": {
              "type": [
                "number",
                "null"
              ],
              "minimum": 0
            },
            "fiber": {
              "type": [
                "number",
                "null"
              ],
              "minimum": 0
            },
            "source": {
              "type": "object"
            },
            "amountPerUnit": {
              "type": [
                "number",
                "null"
              ],
              "exclusiveMinimum": 0
            },
            "recipeUnit": {
              "type": "string",
              "maxLength": 80
            }
          }
        }
      },
      "additionalProperties": false
    }
  }
}
